{
  "schema_version": 1,
  "network_passphrase_hash": "deb8b3feefb5e787942c2aaea171f11188f5857469f1799d3ba8fe821112039d",
  "owner_contract": "CAAAAAAAAAAAAAAAAAAAAAAAAAAAAAAAAAAAAAAAAAAAAAAAAAAABSC4",
  "allowed_tags_hex": [
    "ff0061"
  ],
  "threshold": 1,
  "keys": [
    {
      "key_id": "8183065bf7e528e18d34a7ed62f09353a8afdbf80ab142e456346d7773f959ba",
      "public_key_base64": "ikolUDBJfBiDKWtlO4ryFv2bNEjFzOXsM1wYrdOZMdc=",
      "valid_from_ledger": 1,
      "valid_until_ledger": 1000
    }
  ]
}
